{
  "$schema": "https://json-schema.org/draft/2020-12/schema",
  "$id": "https://saas-core.local/schemas/deployment.schema.json",
  "title": "SaaS Core deployment profile",
  "type": "object",
  "additionalProperties": false,
  "required": ["schemaVersion", "id", "product", "modules", "features"],
  "properties": {
    "$schema": {
      "type": "string"
    },
    "schemaVersion": {
      "const": 1
    },
    "id": {
      "type": "string",
      "pattern": "^[a-z][a-z0-9-]*$"
    },
    "product": {
      "type": "object",
      "additionalProperties": false,
      "required": [
        "name",
        "defaultLocale",
        "supportedLocales",
        "platformDomain"
      ],
      "properties": {
        "name": {
          "type": "string",
          "minLength": 1
        },
        "defaultLocale": {
          "type": "string",
          "pattern": "^[a-z]{2}$"
        },
        "supportedLocales": {
          "type": "array",
          "minItems": 1,
          "uniqueItems": true,
          "items": {
            "type": "string",
            "pattern": "^[a-z]{2}$"
          }
        },
        "platformDomain": {
          "type": "string",
          "minLength": 3
        },
        "localePrefix": {
          "description": "Prefiks języka w trasach hosta platformy (strony produktu, katalog, rezerwacje); nigdy na stronach firm (ADR-071 pkt 13).",
          "enum": ["as-needed", "always"],
          "default": "as-needed"
        }
      }
    },
    "modules": {
      "type": "array",
      "minItems": 1,
      "uniqueItems": true,
      "items": {
        "type": "string",
        "pattern": "^(core|shared|vertical|config)\\.[a-z][a-z0-9-]*$"
      }
    },
    "billing": {
      "type": "object",
      "additionalProperties": false,
      "required": ["planKeys"],
      "properties": {
        "planKeys": {
          "type": "array",
          "minItems": 1,
          "maxItems": 6,
          "uniqueItems": true,
          "items": {
            "type": "string",
            "pattern": "^[a-z][a-z0-9_-]*$"
          }
        }
      }
    },
    "ai": {
      "description": "What may reach an AI model in this deployment (ADR-068 pkt 9). Changing it needs an image rebuild.",
      "type": "object",
      "additionalProperties": false,
      "properties": {
        "sendableDataClasses": {
          "description": "Content classes a model may receive. health never; personal only to endpoints with zero retention. Absent: public and public_personal.",
          "type": "array",
          "uniqueItems": true,
          "minItems": 1,
          "items": { "enum": ["public", "public_personal", "personal"] }
        }
      }
    },
    "settingsDefaults": {
      "description": "The product's starting values for settings (ADR-078 pkt 14): setting key → value, e.g. {\"translation.settings.mode\": \"review\"}. A starting value only, never a ceiling; each module checks its keys when the backend starts.",
      "type": "object",
      "propertyNames": { "pattern": "^[a-z][a-z0-9_]*(\\.[a-z][a-z0-9_]*)+$" },
      "additionalProperties": { "type": ["boolean", "string", "number"] }
    },
    "features": {
      "type": "object",
      "additionalProperties": {
        "type": ["boolean", "string", "number"]
      }
    },
    "organizationTypes": {
      "description": "Typy organizacji produktu (ADR-050). Pierwszy jest domyślny. Bez tej sekcji profil ma jeden typ `business` ze wszystkimi modułami i planami profilu.",
      "type": "array",
      "minItems": 1,
      "items": {
        "type": "object",
        "additionalProperties": false,
        "required": ["key", "label", "modules", "selfSignup"],
        "properties": {
          "key": {
            "type": "string",
            "pattern": "^[a-z][a-z0-9_]*$",
            "maxLength": 40
          },
          "label": { "$ref": "#/$defs/localizedLabel" },
          "description": { "$ref": "#/$defs/localizedLabel" },
          "modules": {
            "description": "Moduły shared/vertical dostępne organizacji tego typu; moduły core ma każda.",
            "type": "array",
            "uniqueItems": true,
            "items": {
              "type": "string",
              "pattern": "^(shared|vertical)\\.[a-z][a-z0-9-]*$"
            }
          },
          "planKeys": {
            "type": "array",
            "minItems": 1,
            "maxItems": 6,
            "uniqueItems": true,
            "items": {
              "type": "string",
              "pattern": "^[a-z][a-z0-9_-]*$"
            }
          },
          "selfSignup": {
            "description": "Czy użytkownik może sam założyć organizację tego typu.",
            "type": "boolean"
          },
          "roles": {
            "description": "Role systemowe typu (ADR-050). Wymagane role owner i admin. Bez tej listy typ używa ról globalnych rdzenia.",
            "type": "array",
            "minItems": 2,
            "items": {
              "type": "object",
              "additionalProperties": false,
              "required": ["key", "label", "permissions"],
              "properties": {
                "key": {
                  "type": "string",
                  "pattern": "^[a-z][a-z0-9_]*$",
                  "maxLength": 64
                },
                "label": { "$ref": "#/$defs/localizedLabel" },
                "permissions": {
                  "type": "array",
                  "uniqueItems": true,
                  "items": {
                    "type": "string",
                    "minLength": 1
                  }
                },
                "limited": {
                  "description": "Rolę może nadać osoba z ograniczonym zarządzaniem członkami (np. kierownik).",
                  "type": "boolean"
                }
              }
            }
          },
          "serviceTemplates": {
            "description": "Szablony usług rezerwacji typu (ADR-050): gotowe usługi do założenia jednym kliknięciem.",
            "type": "array",
            "items": {
              "type": "object",
              "additionalProperties": false,
              "required": ["key", "label", "durationMinutes"],
              "properties": {
                "key": {
                  "type": "string",
                  "pattern": "^[a-z][a-z0-9_]*$"
                },
                "label": { "$ref": "#/$defs/localizedLabel" },
                "durationMinutes": {
                  "type": "integer",
                  "minimum": 5,
                  "maximum": 1440
                },
                "appointmentKind": {
                  "type": "string",
                  "minLength": 1
                }
              }
            }
          },
          "catalogCategories": {
            "description": "Kategorie katalogu publicznego dla tego typu. Brak pola zachowuje słownik rdzenia, pusta lista wyłącza kategorie.",
            "type": "array",
            "items": {
              "type": "object",
              "additionalProperties": false,
              "required": ["key", "label"],
              "properties": {
                "key": {
                  "type": "string",
                  "pattern": "^[a-z][a-z0-9-]*$",
                  "maxLength": 64
                },
                "label": { "$ref": "#/$defs/localizedLabel" },
                "schemaType": {
                  "description": "Podtyp schema.org LocalBusiness, którym jest każda firma tej kategorii (np. LodgingBusiness); trafia do JSON-LD strony firmy jako ['LocalBusiness', podtyp]. Bez pola: samo LocalBusiness.",
                  "type": "string",
                  "pattern": "^[A-Z][A-Za-z]{2,63}$"
                },
                "keywords": {
                  "description": "Słowa, po których wyszukiwarka katalogu znajduje firmy tej kategorii (np. nazwy zawodów), per język.",
                  "type": "object",
                  "propertyNames": { "pattern": "^[a-z]{2}$" },
                  "additionalProperties": {
                    "type": "array",
                    "maxItems": 40,
                    "items": {
                      "type": "string",
                      "minLength": 1,
                      "maxLength": 60
                    }
                  }
                }
              }
            }
          },
          "inventory": {
            "description": "Magazyn dla tego typu (ADR-055): kategorie startowe i pozycje standardowe zakładane każdej firmie. Brak pola daje zestaw rdzenia i brak pozycji standardowych.",
            "type": "object",
            "additionalProperties": false,
            "required": ["categories"],
            "properties": {
              "categories": {
                "type": "array",
                "minItems": 1,
                "items": {
                  "type": "object",
                  "additionalProperties": false,
                  "required": ["key", "label"],
                  "properties": {
                    "key": {
                      "type": "string",
                      "pattern": "^[a-z][a-z0-9_]*$",
                      "maxLength": 64
                    },
                    "label": { "$ref": "#/$defs/localizedLabel" }
                  }
                }
              },
              "defaultItems": {
                "type": "array",
                "items": {
                  "type": "object",
                  "additionalProperties": false,
                  "required": ["key", "name", "category", "unit"],
                  "properties": {
                    "key": {
                      "type": "string",
                      "pattern": "^[a-z][a-z0-9_]*$",
                      "maxLength": 64
                    },
                    "name": { "$ref": "#/$defs/localizedLabel" },
                    "category": {
                      "type": "string",
                      "pattern": "^[a-z][a-z0-9_]*$",
                      "maxLength": 64
                    },
                    "tracksLots": {
                      "type": "boolean"
                    },
                    "unit": {
                      "type": "string",
                      "enum": [
                        "piece",
                        "pack",
                        "ml",
                        "l",
                        "g",
                        "kg",
                        "m",
                        "hour"
                      ]
                    }
                  }
                }
              }
            }
          }
        }
      }
    }
  },
  "allOf": [
    {
      "if": {
        "properties": {
          "modules": {
            "type": "array",
            "contains": {
              "const": "shared.billing"
            }
          }
        },
        "required": ["modules"]
      },
      "then": {
        "properties": {
          "billing": {}
        },
        "required": ["billing"]
      }
    }
  ],
  "$defs": {
    "localizedLabel": {
      "description": "Etykieta w językach: pl i en wymagane (oś panelu), inne języki z rejestru opcjonalne (ADR-071).",
      "type": "object",
      "required": ["pl", "en"],
      "properties": {
        "pl": { "type": "string", "minLength": 1 },
        "en": { "type": "string", "minLength": 1 }
      },
      "propertyNames": { "pattern": "^[a-z]{2}$" },
      "additionalProperties": { "type": "string", "minLength": 1 }
    }
  }
}
