{
  "$schema": "../../packages/contracts/deployment.schema.json",
  "schemaVersion": 1,
  "id": "hoofcare",
  "product": {
    "name": "HoofCare",
    "defaultLocale": "pl",
    "supportedLocales": [
      "pl",
      "en"
    ],
    "platformDomain": "hoofcare.goldenstar.cloud"
  },
  "modules": [
    "core.health",
    "core.identity",
    "core.organizations",
    "shared.billing",
    "shared.sites",
    "shared.media",
    "shared.profiles",
    "shared.notifications",
    "shared.booking",
    "shared.seo",
    "vertical.hoofcare"
  ],
  "billing": {
    "planKeys": [
      "profile",
      "starter",
      "pro"
    ]
  },
  "features": {
    "customDomains": true,
    "publicBooking": true
  }
}
