{
  "$schema": "../../packages/contracts/deployment.schema.json",
  "schemaVersion": 1,
  "id": "agro",
  "product": {
    "name": "SaaS Core Agro (profil wzorcowy)",
    "defaultLocale": "pl",
    "supportedLocales": ["pl", "en"],
    "platformDomain": "agro.localhost"
  },
  "modules": [
    "core.health",
    "core.identity",
    "core.organizations",
    "shared.model-port",
    "shared.billing",
    "shared.sites",
    "shared.media",
    "shared.image-generation",
    "shared.profiles",
    "shared.notifications",
    "shared.translation",
    "shared.booking",
    "shared.seo",
    "shared.farms",
    "shared.inventory"
  ],
  "billing": {
    "planKeys": ["profile", "starter", "pro"]
  },
  "features": {
    "customDomains": true,
    "publicBooking": true
  }
}
