{
  "$schema": "../../packages/contracts/deployment.schema.json",
  "schemaVersion": 1,
  "id": "vps-dev",
  "product": {
    "name": "SaaS Core Business (dev VPS)",
    "defaultLocale": "pl",
    "supportedLocales": ["pl", "en", "de"],
    "platformDomain": "saas.goldenstar.cloud"
  },
  "modules": [
    "core.health",
    "core.identity",
    "core.organizations",
    "shared.model-port",
    "shared.billing",
    "shared.sites",
    "shared.media",
    "shared.image-generation",
    "shared.profiles",
    "shared.notifications",
    "shared.translation",
    "shared.customers",
    "shared.commerce",
    "shared.booking",
    "shared.seo",
    "shared.inventory"
  ],
  "billing": {
    "planKeys": ["profile", "starter", "pro"]
  },
  "settingsDefaults": {
    "inventory.alerts.low_stock": "daily"
  },
  "features": {
    "customDomains": true,
    "publicBooking": true,
    "customerRetention": true
  }
}
